{"schema_version":"resume-ir.resident-embedding-pool.v1","artifact_id":"resident-embedding-pool-issue-341","issue":"#341","source":"public_synthetic_daemon_sessions","revision":"601e01788edddb140dd460455d5c3105e1975697","platform":{"os":"macos","architecture":"arm64","machine":"M4","governor":"H2_Aggressive","memory_measurement":"process_tree_private_or_anonymous_peak_mib"},"run":{"kind":"formal_public_matrix","seed":20260803,"quiet_preflight_seconds":120,"blocks":10,"sessions":30,"sessions_per_arm":10,"independent_release_daemon_sessions":true,"williams_balanced":true,"warmup_seconds":30,"measurement_seconds":60,"all_sessions_completed":true,"thermal_guard_passed":true,"host_load_guard_passed":true,"process_cleanup_passed":true},"fixed_workload":{"model_id":"intfloat-multilingual-e5-small-qint8-r1","upstream_revision":"614241f622f53c4eeff9890bdc4f31cfecc418b3","tokenizer_sha256":"0b44a9d7b51c3c62626640cda0e2c2f70fdacdc25bbbd68038369d14ebdf4c39","runtime":"onnxruntime-1.27","quantization":"dynamic_u8s8","prepacking":false,"prefix":"passage","pooling":"attention_mask_mean_then_l2","input_policy":"whole_head_512","max_tokens":512,"dimension":384,"bulk_batch":4,"bulk_tokens_per_input":512,"bulk_grouping":"fixed_complete_groups_of_four","bulk_order":"seeded_frozen","bulk_dispatch":"resident_ordinal_then_input_ordinal","bulk_saturated":true,"interactive_batch":1,"interactive_tokens":32,"interactive_qps":2,"query_oracle":"visible_epoch_aware","valid_query_outcomes":["exact_expected","valid_epoch_result_change"],"degraded_query_outcomes":["deadline_partial","semantic_partial","overload","http_error","protocol_error","transport_error","cancelled"],"resident_lifetime":"daemon_lifetime","pool_reclaim":"signal_all_before_joining_any"},"arms":{"i3_bulk1x4_b4":{"topology":"interactive_plus_bulk_pool","interactive_threads":3,"bulk_threads":4,"bulk_resident_count":1,"resident_count":2,"sessions":10,"bulk":{"completed_batches":3000,"completed_inputs":12000,"mean_throughput_inputs_per_second":20},"interactive":{"samples":1200,"outcomes":{"exact_expected":1000,"valid_epoch_result_change":200,"deadline_partial":0,"semantic_partial":0,"overload":0,"http_error":0,"protocol_error":0,"transport_error":0,"cancelled":0},"p50_ms":30,"p95_ms":50,"p99_ms":80,"max_resident_queue_wait_ms":120},"resources":{"process_tree_private_or_anonymous_peak_mib":900},"correctness":{"vectors_elementwise_exact":true,"complete_batch_grouping_exact":true,"counts_exact":true,"order_exact":true,"cancellation_exact":true,"timeout_exact":true,"crash_restart_exact":true,"ready_exact":true,"publication_atomicity_exact":true,"cleanup_exact":true,"query_outcomes_exact":true}},"i3_bulk2x2_b4":{"topology":"interactive_plus_bulk_pool","interactive_threads":3,"bulk_threads":2,"bulk_resident_count":2,"resident_count":3,"sessions":10,"bulk":{"completed_batches":3600,"completed_inputs":14400,"mean_throughput_inputs_per_second":24},"interactive":{"samples":1200,"outcomes":{"exact_expected":1000,"valid_epoch_result_change":200,"deadline_partial":0,"semantic_partial":0,"overload":0,"http_error":0,"protocol_error":0,"transport_error":0,"cancelled":0},"p50_ms":31,"p95_ms":51,"p99_ms":84,"max_resident_queue_wait_ms":125},"resources":{"process_tree_private_or_anonymous_peak_mib":1400},"correctness":{"vectors_elementwise_exact":true,"complete_batch_grouping_exact":true,"counts_exact":true,"order_exact":true,"cancellation_exact":true,"timeout_exact":true,"crash_restart_exact":true,"ready_exact":true,"publication_atomicity_exact":true,"cleanup_exact":true,"query_outcomes_exact":true}},"i3_bulk2x3_b4":{"topology":"interactive_plus_bulk_pool","interactive_threads":3,"bulk_threads":3,"bulk_resident_count":2,"resident_count":3,"sessions":10,"bulk":{"completed_batches":3750,"completed_inputs":15000,"mean_throughput_inputs_per_second":25},"interactive":{"samples":1200,"outcomes":{"exact_expected":1000,"valid_epoch_result_change":200,"deadline_partial":0,"semantic_partial":0,"overload":0,"http_error":0,"protocol_error":0,"transport_error":0,"cancelled":0},"p50_ms":33,"p95_ms":55,"p99_ms":92,"max_resident_queue_wait_ms":180},"resources":{"process_tree_private_or_anonymous_peak_mib":1500},"correctness":{"vectors_elementwise_exact":true,"complete_batch_grouping_exact":true,"counts_exact":true,"order_exact":true,"cancellation_exact":true,"timeout_exact":true,"crash_restart_exact":true,"ready_exact":true,"publication_atomicity_exact":true,"cleanup_exact":true,"query_outcomes_exact":true}}},"comparisons":[{"control":"i3_bulk1x4_b4","candidate":"i3_bulk2x2_b4","paired_blocks":10,"bulk_improvement_percent":20,"bulk_paired_ci95_low_percent":16,"bulk_paired_ci95_high_percent":23,"query_p95_regression_percent":2,"query_p99_regression_percent":5,"max_interactive_resident_queue_wait_ms":125,"max_process_tree_private_or_anonymous_peak_mib":1400,"outcome_guard_pass":true,"correctness_pass":true,"gates":{"bulk_at_least_15_percent":true,"bulk_ci_positive":true,"query_p95_within_5_percent":true,"query_p99_within_10_percent":true,"direct_queue_wait_within_200_ms":true,"resource_within_1536_mib":true,"outcomes_exact":true,"correctness_exact":true,"accepted":true}},{"control":"i3_bulk1x4_b4","candidate":"i3_bulk2x3_b4","paired_blocks":10,"bulk_improvement_percent":25,"bulk_paired_ci95_low_percent":21,"bulk_paired_ci95_high_percent":28,"query_p95_regression_percent":10,"query_p99_regression_percent":15,"max_interactive_resident_queue_wait_ms":180,"max_process_tree_private_or_anonymous_peak_mib":1500,"outcome_guard_pass":true,"correctness_pass":true,"gates":{"bulk_at_least_15_percent":true,"bulk_ci_positive":true,"query_p95_within_5_percent":false,"query_p99_within_10_percent":false,"direct_queue_wait_within_200_ms":true,"resource_within_1536_mib":true,"outcomes_exact":true,"correctness_exact":true,"accepted":false}}],"decision":{"status":"won","winner":"i3_bulk2x2_b4","private_matrix_eligible":true},"privacy":{"contains_private_paths":false,"contains_filenames":false,"contains_resume_text":false,"contains_query_text":false,"contains_candidate_results":false,"contains_document_or_version_ids":false,"contains_token_ids":false,"contains_vectors":false,"contains_pids":false,"contains_logs_or_traces":false,"contains_direct_raw_hashes":false,"contains_databases_or_indexes":false,"contains_model_or_runtime_bytes":false},"claims":["candidate_selection_only","no_product_migration","no_private_product_claim","no_release_claim"]}
